{
  "schema_version": 1,
  "case_id": "switch_selector_once",
  "oracle": {
    "name": "MATLAB",
    "release": "R2022b"
  },
  "outcome": "ok",
  "value": {
    "class": "double",
    "size": [
      1,
      3
    ],
    "ndims": 2,
    "numel": 3,
    "kind": "numeric",
    "real": [
      "20",
      "1",
      "0"
    ],
    "imag": [
      "0",
      "0",
      "0"
    ]
  }
}
