{
  "schema_version": 1,
  "case_id": "colon_matrix_indexing",
  "oracle": {
    "name": "MATLAB",
    "release": "R2022b"
  },
  "outcome": "ok",
  "value": {
    "class": "double",
    "size": [
      2,
      1
    ],
    "ndims": 2,
    "numel": 2,
    "kind": "numeric",
    "real": [
      "2",
      "5"
    ],
    "imag": [
      "0",
      "0"
    ]
  }
}
