{
  "schema_version": 1,
  "case_id": "event_listener_lifecycle",
  "oracle": {
    "name": "MATLAB",
    "release": "R2022b"
  },
  "outcome": "ok",
  "value": {
    "class": "logical",
    "size": [
      1,
      2
    ],
    "ndims": 2,
    "numel": 2,
    "kind": "logical",
    "logical": [
      false,
      false
    ]
  }
}
