{
  "schema_version": 1,
  "case_id": "class_abstract_static_override",
  "oracle": {
    "name": "MATLAB",
    "release": "R2022b"
  },
  "outcome": "ok",
  "value": {
    "class": "double",
    "size": [
      1,
      1
    ],
    "ndims": 2,
    "numel": 1,
    "kind": "numeric",
    "real": [
      "12"
    ],
    "imag": [
      "0"
    ]
  }
}
